CandidateID,Skills,Interests,Hobbies,Work_Style,Career_Goals,Recommended_Career,Career_Category,Intermediate_Path,Salary_PKR_Monthly
217,HR Management;Communication;Negotiation;CRM,People;Operations,Starting Small Businesses,Traveling and networking,Build a brand;Become a marketing leader,Supply Chain Manager,Business & Marketing,ICOM (Commerce),115000
218,Content Creation;Photography;GIS;Soil Science,Nature;Broadcasting;Teaching,Teaching Younger Students,Teaching and explaining concepts,Raise awareness through media;Make a difference in society,Environmental Scientist,Education & Media,FA (Arts) or FSc,95000
219,Illustrator;Interior Design;Video Editing;Color Theory;3D Visualization,Digital Media;Design;Creativity,Watching Design Videos,Working creatively and freely,Express creativity professionally;Start a creative agency,Graphic Designer,Design & Creative,FA (Arts) or ICS,175000
220,FBR;International Relations;Economics,Justice;Social Issues,Reading History Books,Working with government and institutions,Pass CSS exams;Become a senior advocate,Corporate Lawyer,Law & Social Sciences,FA (Arts) or FSc,210000
221,Financial Reporting;Accounting;Stock Market;Financial Modeling;Budgeting,Business;Business Strategy,Reading Business News,Office-based desk work,Work in government finance departments;Work in banking sector,ACCA Accountant,Finance & Commerce,ICOM (Commerce),140000
222,Agile;CRM;Sales,Management;Strategy,Sports;Watching Entrepreneurship Videos,Communicating with different stakeholders,High salary in management,Business Analyst,Business & Marketing,ICOM (Commerce),165000
223,Banking Operations;Credit Analysis;Taxation;Investment Analysis;Financial Modeling,Investing;Law;Stock Market,Reading Finance Books;Networking Events,Working under strict deadlines,Work in banking sector,Banker,Finance & Commerce,ICOM (Commerce),85000
224,Legal Research;Constitutional Law;SECP Regulations;Policy Analysis,Politics;Government,Reading News;Debating,Working with government and institutions,Influence policy making;Pass CSS exams,Lawyer,Law & Social Sciences,FA (Arts) or FSc,165000
225,Sustainability;Crop Science;Subject Knowledge;Photography,Social Work;Writing,Watching Documentaries,Teaching and explaining concepts,Job stability in government,Environmental Scientist,Education & Media,FA (Arts) or FSc,60000
226,Algorithms;Deep Learning;API Development;Computer Vision,Cloud Technology;Mobile Apps;Automation,Reading Tech Blogs;Participating in Hackathons,Remote work and freelancing,Start a tech startup,Network Engineer,IT & Data,ICS (Pre-Engineering),140000
227,Taxation;Financial Reporting;Financial Modeling;Auditing,Numbers;Finance,Tracking Stock Markets,Analyzing financial reports,Work in government finance departments;Start a financial consultancy,Chartered Accountant,Finance & Commerce,ICOM (Commerce),205000
228,CAD;Circuit Design;Power Systems;MATLAB,Robotics;Construction;Physics,Reading Science Magazines,Working in teams on large projects,High salary in engineering firms,Architect,Engineering,FSc Pre-Engineering,180000
229,Figma;3D Visualization;Pattern Making,Colors;Interior Decoration,Watching Design Videos,Working on aesthetics and visuals,Work in media and advertising;Collaborate with global clients,UX/UI Designer,Design & Creative,FA (Arts) or ICS,130000
230,Accounting;Financial Modeling;Taxation;Budgeting;Investment Analysis,Numbers;Money Management;Investing,Playing Chess;Managing Personal Budget,Working with numbers and data,Manage large investments;Work in government finance departments,Chartered Accountant,Finance & Commerce,ICOM (Commerce),95000
231,Negotiation;CRM;E-commerce,Branding;Team Work;Strategy,Public Speaking,Leading teams and projects,Work in corporate sector,Digital Marketer,Business & Marketing,ICOM (Commerce),185000
232,3D Visualization;UX Research;Video Editing,Creativity;Visual Arts;Colors,DIY Crafts;Video Editing,Working creatively and freely,Start a creative agency,Video Editor,Design & Creative,FA (Arts) or ICS,80000
233,Machine Learning;Android Development;React;Computer Vision,Programming;Software Development;Data Science,Open Source Contribution;Math Competitions,Solving logical problems,Work in top global companies,Network Engineer,IT & Data,ICS (Pre-Engineering),190000
234,Nursing Procedures;Clinical Skills;Physiology;Patient Care;Surgery,Healthcare;Medicine,Playing Sports,Working directly with people,Work in government hospitals;Job stability and security,Nurse,Medical & Health,FSc Pre-Medical,175000
235,Medical Research;Nutrition;Patient Care;Chemistry,Human Body;Science,Reading Medical Journals,Working in a team of professionals,Achieve social respect;Open my own clinic,Dentist,Medical & Health,FSc Pre-Medical,230000
236,HR Management;Agile;Project Management;Communication;E-commerce,People;Leadership;Strategy,Networking,Creative and strategic thinking,Lead a team,Marketing Manager,Business & Marketing,ICOM (Commerce),70000
237,Linux;TensorFlow;JavaScript;Data Analysis,Innovation;Gaming;Software Development,Watching Tech YouTube;Building PCs,Analyzing data and finding patterns,Solve real-world tech problems,Software Engineer,IT & Data,ICS (Pre-Engineering),275000
238,Soil Science;Reporting;Content Creation;Agriculture,Journalism;Nature,Photography;Blogging,Community engagement,Make a difference in society;Serve the community through education,Journalist,Education & Media,FA (Arts) or FSc,55000
239,UI Design;Wireframing;Color Theory;Graphic Design;Prototyping,Storytelling;Colors;Media,Creating Digital Art,Working on design projects independently,Earn through passion,Graphic Designer,Design & Creative,FA (Arts) or ICS,65000
240,Prototyping;Photoshop;Video Editing;UX Research,Visual Arts;Interior Decoration;Colors,Video Editing,Working creatively and freely,Start a creative agency,Interior Designer,Design & Creative,FA (Arts) or ICS,145000
241,Urban Planning;Robotics;AutoCAD;Construction Management;3D Modeling,Building Things;Science;Problem Solving,Scale Modelling;Visiting Construction Sites,Working on physical projects,High salary in engineering firms;Build infrastructure for Pakistan,Civil Engineer,Engineering,FSc Pre-Engineering,100000
242,Mechanics;3D Modeling;Structural Analysis;Construction Management,Robotics;Science,Scale Modelling;Solving Math Problems,Working on physical projects,Contribute to national development;Job stability in government,Electrical Engineer,Engineering,FSc Pre-Engineering,210000
243,Civil Design;Circuit Design;Manufacturing;Project Management;Electrical Systems,Infrastructure;Physics;Construction,Sketching Structures,Building and constructing things,Start my own construction company,Architect,Engineering,FSc Pre-Engineering,155000
244,Legal Research;Tax Law;Research Methods;SECP Regulations;Policy Analysis,History;Justice;Policy Making,Reading News,Long hours of reading and research,Work in government sector;Work in international law,Economist,Law & Social Sciences,FA (Arts) or FSc,360000
245,Thermodynamics;Power Systems;Site Supervision,Innovation;Physics;Infrastructure,DIY Projects;Astronomy,Working with calculations and designs,Work on mega projects,Electrical Engineer,Engineering,FSc Pre-Engineering,180000
246,Branding;Figma;Interior Design,Media;Visual Arts,Fashion Styling;Painting,Using creative tools and software,Start a creative agency;Collaborate with global clients,Fashion Designer,Design & Creative,FA (Arts) or ICS,65000
247,Unity;AWS;Cybersecurity,Programming;Data Science,Reading Tech Blogs;Coding Personal Projects,Building and creating software,Work remotely and freelance globally,Game Developer,IT & Data,ICS (Pre-Engineering),270000
248,SECP Regulations;Political Science;Contract Law;Tax Law,History;Research;Justice,Debating;Watching Documentaries,Working with policies and regulations,Work in government sector;Work in international law,Diplomat/CSS Officer,Law & Social Sciences,FA (Arts) or FSc,400000
249,Surgery;Chemistry;Dentistry,Community Service;Medicine;Research,Meditation;Playing Sports,Following structured procedures,Job stability and security;Achieve social respect,Psychologist,Medical & Health,FSc Pre-Medical,120000
250,First Aid;Chemistry;Physiology,Patient Care;Biology;Community Service,Meditation;Helping Neighbors,Helping and caring for others,Open my own clinic;Work in government hospitals,Doctor (MBBS),Medical & Health,FSc Pre-Medical,80000
251,Java;Data Analysis;API Development;React,Cloud Technology;Research;Cybersecurity,Math Competitions,Working independently with deadlines,High salary and financial freedom;Build innovative products,Network Engineer,IT & Data,ICS (Pre-Engineering),160000
252,Video Editing;Photoshop;Interior Design;Prototyping,Colors;Art,Watching Design Videos;Creating Digital Art,Flexible working hours,Start a creative agency;Build a design portfolio,Fashion Designer,Design & Creative,FA (Arts) or ICS,145000
253,Urban Planning;Thermodynamics;MATLAB;Robotics,Construction;Electronics;Science,Electronics Tinkering;Reading Science Magazines,Working in teams on large projects,Job stability in government,Mechanical Engineer,Engineering,FSc Pre-Engineering,125000
254,Subject Knowledge;Curriculum Development;Agriculture;Content Creation;Teaching,Writing;Teaching,Reading Books;Gardening,Flexible and creative work environment,Serve the community through education;Become a respected journalist,Journalist,Education & Media,FA (Arts) or FSc,40000
255,Communication;Market Research;Recruitment;Digital Marketing;Negotiation,Management;Sales,Sports,Leading teams and projects,Grow professionally in business;Start my own business,Marketing Manager,Business & Marketing,ICOM (Commerce),195000
256,Corporate Law;Policy Analysis;FBR;Negotiation;Research Methods,Debating;International Affairs;Politics,Traveling,Working with government and institutions,Work in government sector;Influence policy making,Economist,Law & Social Sciences,FA (Arts) or FSc,240000
257,Financial Modeling;Corporate Finance;IFRS;Portfolio Management,Investing;Numbers,Managing Personal Budget,Working with numbers and data,Financial independence and high salary,Banker,Finance & Commerce,ICOM (Commerce),135000
258,Wireframing;Interior Design;Prototyping;After Effects;Typography,Digital Media;Colors,Reading Design Books,Freelance and project-based work,Build a recognizable brand,Graphic Designer,Design & Creative,FA (Arts) or ICS,130000
259,Civil Design;Architecture Design;Robotics;CAD,Robotics;Science,Reading Science Magazines,Hands-on practical work,Contribute to national development,Architect,Engineering,FSc Pre-Engineering,215000
260,Contract Law;Litigation;SECP Regulations,Economics;Law;History,Reading News,Research and writing,Work in international law;Work in government sector,Diplomat/CSS Officer,Law & Social Sciences,FA (Arts) or FSc,255000
261,Site Supervision;AutoCAD;Construction Management;Thermodynamics;Robotics,Problem Solving;Electronics;Design,Solving Math Problems,Building and constructing things,Work abroad in engineering,Electrical Engineer,Engineering,FSc Pre-Engineering,125000
262,Environmental Science;Journalism;Climate Analysis;Teaching,Social Work;Research,Gardening;Community Work,Community engagement,Serve the community through education,Agricultural Officer,Education & Media,FA (Arts) or FSc,90000
263,Content Writing;Digital Marketing;Communication,Leadership;Branding;Marketing,Volunteering,Working with people and clients,Become a marketing leader,Supply Chain Manager,Business & Marketing,ICOM (Commerce),185000
264,Pathology;First Aid;Pharmacology;Dentistry;Biology,Community Service;Patient Care;Healthcare,Meditation;Playing Sports,Long shifts with high responsibility,Job stability and security;Help and save lives,Doctor (MBBS),Medical & Health,FSc Pre-Medical,250000
265,Video Editing;Wireframing;Typography,Creativity;Drawing,Painting;Video Editing,Working creatively and freely,Express creativity professionally,Interior Designer,Design & Creative,FA (Arts) or ICS,170000
266,Pathology;Nutrition;Microbiology;Physiology,Biology;Research;Community Service,Cooking Healthy Food;Volunteering at Hospitals,Hands-on practical work,Work in government hospitals,Psychologist,Medical & Health,FSc Pre-Medical,190000
267,MATLAB;Construction Management;Architecture Design,Mathematics;Infrastructure;Science,Scale Modelling,Solving technical problems,High salary in engineering firms,Electrical Engineer,Engineering,FSc Pre-Engineering,160000
268,CA;Portfolio Management;Banking Operations;Stock Market;Excel,Investing;Numbers,Playing Chess;Reading Finance Books,Analyzing financial reports,Work in top accounting firms;Achieve professional certification,Investment Analyst,Finance & Commerce,ICOM (Commerce),165000
269,Sales;Supply Chain;HR Management;Digital Marketing,Marketing;Business,Debating,Communicating with different stakeholders,High salary in management,Business Analyst,Business & Marketing,ICOM (Commerce),115000
270,Chemistry;Counseling;Medical Research,Community Service;Biology,Meditation;Gardening,Working directly with people,Open my own clinic;Specialize in medicine,Nurse,Medical & Health,FSc Pre-Medical,230000
271,Pattern Making;Color Theory;Sketching,Media;Fashion,Watching Design Videos,Using creative tools and software,Collaborate with global clients;Work as a freelance designer,UX/UI Designer,Design & Creative,FA (Arts) or ICS,120000
272,Physiology;Medical Research;Biochemistry;Patient Care,Science;Wellness,First Aid Training,Hands-on practical work,Help and save lives,Psychologist,Medical & Health,FSc Pre-Medical,90000
273,Manufacturing;3D Modeling;Project Management;Urban Planning;Robotics,Construction;Infrastructure;Science,Sketching Structures,Using tools and equipment,Work abroad in engineering,Civil Engineer,Engineering,FSc Pre-Engineering,110000
274,Credit Analysis;CA;Accounting,Finance;Law;Banking,Reading Business News;Managing Personal Budget,Working under strict deadlines,Achieve professional certification;Financial independence and high salary,Chartered Accountant,Finance & Commerce,ICOM (Commerce),105000
275,Accounting;Portfolio Management;IFRS,Stock Market;Law,Business Case Studies,Following rules and regulations,Financial independence and high salary,Financial Analyst,Finance & Commerce,ICOM (Commerce),245000
276,E-commerce;Project Management;Logistics,Social Media;Team Work;Sales,Watching Entrepreneurship Videos,Leading teams and projects,Start my own business,Supply Chain Manager,Business & Marketing,ICOM (Commerce),115000
277,Negotiation;Political Science;International Relations;Policy Analysis,Government;Research,Watching Documentaries;Public Speaking,Working with diverse communities,Work in international law,Corporate Lawyer,Law & Social Sciences,FA (Arts) or FSc,145000
278,Interior Design;Video Editing;Illustrator,Interior Decoration;Digital Media,Photography;Painting,Expressing ideas visually,Work as a freelance designer,Fashion Designer,Design & Creative,FA (Arts) or ICS,150000
279,HR Management;Sales;Content Writing;Project Management;Social Media,Branding;Business;Sales,Volunteering,Managing multiple tasks,Work in corporate sector;High salary in management,Marketing Manager,Business & Marketing,ICOM (Commerce),130000
280,Diplomacy;Constitutional Law;Political Science;Research Methods;Contract Law,History;International Affairs;Politics,Volunteering,Research and writing,Serve the public,Diplomat/CSS Officer,Law & Social Sciences,FA (Arts) or FSc,285000
281,Agile;CRM;Business Strategy,Communication;Business,Debating,Creative and strategic thinking,Start my own business,Supply Chain Manager,Business & Marketing,ICOM (Commerce),100000
282,Biochemistry;Anatomy;Nutrition;Diagnosis;Surgery,Healthcare;Research,First Aid Training,Helping and caring for others,Work in government hospitals,Pharmacist,Medical & Health,FSc Pre-Medical,170000
283,CRM;Market Research;Content Writing;E-commerce;Agile,Operations;Business;Team Work,Watching Entrepreneurship Videos,Leading teams and projects,Grow professionally in business;High salary in management,Supply Chain Manager,Business & Marketing,ICOM (Commerce),130000
284,Corporate Finance;Budgeting;Taxation;Accounting;Credit Analysis,Law;Investing,Solving Puzzles,Office-based desk work,Manage large investments;Work in banking sector,ACCA Accountant,Finance & Commerce,ICOM (Commerce),200000
285,Drafting;Statistics;International Relations;Tax Law,Politics;History;Government,Volunteering,Debating and arguing cases,Influence policy making,Corporate Lawyer,Law & Social Sciences,FA (Arts) or FSc,380000
286,Risk Management;Taxation;Accounting;Corporate Finance,Accounting;Banking;Business,Solving Puzzles;Business Case Studies,Working independently on accounts,Work in top accounting firms;Manage large investments,Chartered Accountant,Finance & Commerce,ICOM (Commerce),195000
287,3D Modeling;Circuit Design;Thermodynamics;Structural Analysis;CAD,Machines;Problem Solving;Science,Playing with Lego,Using tools and equipment,Build infrastructure for Pakistan,Architect,Engineering,FSc Pre-Engineering,85000
288,Research Methods;Corporate Law;Statistics;Economics,Law;Policy Making,Writing Articles;Community Work,Working with policies and regulations,Serve the public,Lawyer,Law & Social Sciences,FA (Arts) or FSc,260000
289,Leadership;Social Media;Supply Chain;Business Strategy,Communication;Business;Operations,Sports,Working with people and clients,Build a brand;Grow professionally in business,HR Manager,Business & Marketing,ICOM (Commerce),145000
290,Crop Science;Reporting;Public Speaking;Photography;Content Creation,Journalism;Media,Teaching Younger Students,Broadcasting and reporting,Contribute to agricultural development;Work in NGOs and international organizations,Journalist,Education & Media,FA (Arts) or FSc,55000
291,Litigation;Statistics;Negotiation;Foreign Policy;Political Science,Social Issues;Politics;Justice,Reading News;Reading History Books,Long hours of reading and research,Achieve justice and fairness;Pass CSS exams,Economist,Law & Social Sciences,FA (Arts) or FSc,220000
292,Agriculture;Communication;Broadcasting,Nature;Research;Social Work,Writing Stories,Conducting research and fieldwork,Raise awareness through media;Contribute to agricultural development,Teacher,Education & Media,FA (Arts) or FSc,75000
293,Photoshop;Fashion Design;Typography;Graphic Design;Wireframing,Fashion;Interior Decoration;Creativity,Watching Design Videos,Using creative tools and software,Express creativity professionally,Fashion Designer,Design & Creative,FA (Arts) or ICS,95000
294,SEO;E-commerce;Agile,Branding;Leadership,Writing Blogs,Traveling and networking,Work in top companies,HR Manager,Business & Marketing,ICOM (Commerce),85000
295,Adobe XD;Pattern Making;Video Editing,Visual Arts;Drawing,DIY Crafts,Collaborating with clients,Work in media and advertising,Fashion Designer,Design & Creative,FA (Arts) or ICS,120000
296,Pattern Making;Branding;Color Theory;Fashion Design;UI Design,Fashion;Visual Arts,Fashion Styling,Working on design projects independently,Work in media and advertising,Graphic Designer,Design & Creative,FA (Arts) or ICS,100000
297,First Aid;Chemistry;Pharmacology;Medical Research,Helping People;Community Service;Mental Health,Reading Medical Journals;Helping Neighbors,Long shifts with high responsibility,Job stability and security;Open my own clinic,Psychologist,Medical & Health,FSc Pre-Medical,160000
298,Project Management;Power Systems;Architecture Design,Machines;Building Things,Sketching Structures;Playing with Lego,Using tools and equipment,Contribute to national development;Solve structural challenges,Mechanical Engineer,Engineering,FSc Pre-Engineering,205000
299,Litigation;FBR;Diplomacy;International Relations,Justice;History;Politics,Debating;Watching Documentaries,Working with diverse communities,Become a senior advocate,Corporate Lawyer,Law & Social Sciences,FA (Arts) or FSc,355000
300,Figma;Adobe XD;Illustrator;Typography;UI Design,Art;Photography;Creativity,Video Editing;Reading Design Books,Working creatively and freely,Start a creative agency;Earn through passion,Graphic Designer,Design & Creative,FA (Arts) or ICS,100000
301,UX Research;Color Theory;3D Visualization;Premiere Pro,Media;Photography;Storytelling,Creating Digital Art;DIY Crafts,Collaborating with clients,Collaborate with global clients,Video Editor,Design & Creative,FA (Arts) or ICS,110000
302,Content Creation;Teaching;Agriculture,Teaching;Social Work,Teaching Younger Students,Working outdoors in nature,Work for environmental causes;Contribute to agricultural development,Teacher,Education & Media,FA (Arts) or FSc,65000
303,Adobe XD;Graphic Design;Interior Design;Color Theory;Illustrator,Photography;Media;Digital Media,Drawing and Sketching,Collaborating with clients,Work in media and advertising;Collaborate with global clients,Fashion Designer,Design & Creative,FA (Arts) or ICS,65000
304,CA;Financial Reporting;Economics;ACCA,Law;Finance,Entrepreneurship Blogs,Presenting reports to clients,Become a CA or ACCA qualified;Manage large investments,Financial Analyst,Finance & Commerce,ICOM (Commerce),195000
305,Sustainability;Curriculum Development;Communication,Writing;Media;Community Service,Photography;Gardening,Teaching and explaining concepts,Raise awareness through media;Serve the community through education,Agricultural Officer,Education & Media,FA (Arts) or FSc,70000
306,Mechanics;Site Supervision;MATLAB;Structural Analysis;Thermodynamics,Electronics;Robotics,DIY Projects,Building and constructing things,Work on mega projects;Build infrastructure for Pakistan,Civil Engineer,Engineering,FSc Pre-Engineering,75000
307,Construction Management;Site Supervision;Robotics,Mathematics;Electronics,Solving Math Problems;Electronics Tinkering,Working on site and in offices,High salary in engineering firms,Electrical Engineer,Engineering,FSc Pre-Engineering,180000
308,CA;Auditing;Risk Management,Finance;Stock Market,Reading Finance Books;Debating,Office-based desk work,Work in top accounting firms;Work in banking sector,ACCA Accountant,Finance & Commerce,ICOM (Commerce),190000
309,Logistics;Project Management;Brand Management;HR Management,Marketing;Team Work;Strategy,Running Social Media Pages,Managing multiple tasks,High salary in management;Work in corporate sector,Marketing Manager,Business & Marketing,ICOM (Commerce),195000
310,Auditing;Portfolio Management;Accounting;Excel,Economics;Finance,Tracking Stock Markets,Presenting reports to clients,Work in government finance departments,Banker,Finance & Commerce,ICOM (Commerce),255000
311,Mental Health;Clinical Skills;Biology;Physiology,Helping People;Human Body;Biology,Helping Neighbors,Hands-on practical work,Help and save lives;Work in government hospitals,Nurse,Medical & Health,FSc Pre-Medical,110000
312,Patient Care;Physiology;Nutrition;Microbiology;Surgery,Community Service;Patient Care;Mental Health,Gardening,Working in a clinical environment,Achieve social respect,Nurse,Medical & Health,FSc Pre-Medical,200000
313,Fashion Design;After Effects;3D Visualization;Typography;Interior Design,Colors;Art;Visual Arts,DIY Crafts;Creating Digital Art,Working creatively and freely,Build a recognizable brand,Fashion Designer,Design & Creative,FA (Arts) or ICS,165000
314,Credit Analysis;Economics;IFRS,Banking;Stock Market;Business,Tracking Stock Markets;Reading Finance Books,Presenting reports to clients,Start a financial consultancy;Work in top accounting firms,ACCA Accountant,Finance & Commerce,ICOM (Commerce),290000
315,Legal Research;SECP Regulations;Public Speaking;Policy Analysis,Policy Making;Justice,Following Politics;Traveling,Analytical and critical thinking,Become a senior advocate;Pass CSS exams,Diplomat/CSS Officer,Law & Social Sciences,FA (Arts) or FSc,110000
316,Constitutional Law;Litigation;Legal Research;Research Methods;Diplomacy,Law;International Affairs;Justice,Following Politics,Research and writing,Work in government sector;Pass CSS exams,Economist,Law & Social Sciences,FA (Arts) or FSc,105000
317,CAD;Manufacturing;Structural Analysis,Construction;Innovation,Visiting Construction Sites;Scale Modelling,Working on physical projects,Contribute to national development,Architect,Engineering,FSc Pre-Engineering,110000
318,Negotiation;Communication;Sales;CRM;E-commerce,Branding;Operations;Marketing,Watching Entrepreneurship Videos,Managing multiple tasks,Work in corporate sector,Business Analyst,Business & Marketing,ICOM (Commerce),185000
319,Statistics;Corporate Law;Diplomacy;International Relations,Government;Economics;Law,Reading History Books,Public speaking and presentations,Work in international law,Lawyer,Law & Social Sciences,FA (Arts) or FSc,305000
320,Physiology;Nursing Procedures;Surgery;Biology;Patient Care,Healthcare;Medicine,Gardening,Long shifts with high responsibility,Work in government hospitals,Nurse,Medical & Health,FSc Pre-Medical,130000
321,UI Design;Figma;3D Visualization;Adobe XD;Color Theory,Digital Media;Colors;Interior Decoration,Watching Design Videos;Reading Design Books,Working on design projects independently,Earn through passion;Start a creative agency,Fashion Designer,Design & Creative,FA (Arts) or ICS,95000
322,3D Visualization;Adobe XD;Branding;UI Design,Drawing;Creativity,Reading Design Books,Expressing ideas visually,Earn through passion,Video Editor,Design & Creative,FA (Arts) or ICS,130000
323,Power Systems;Urban Planning;Civil Design;Project Management;MATLAB,Problem Solving;Machines;Science,Visiting Construction Sites;Solving Math Problems,Solving technical problems,Work abroad in engineering,Electrical Engineer,Engineering,FSc Pre-Engineering,155000
324,Drafting;Research Methods;Statistics;Legal Research;SECP Regulations,Law;Research;History,Debating;Volunteering,Working with diverse communities,Become a senior advocate,Lawyer,Law & Social Sciences,FA (Arts) or FSc,120000
